<?xml version="1.0" encoding="UTF-8"?>
<!DOCTYPE JPACS SYSTEM "JPACS.dtd">

<JPACS>
   <config nome="C:\Java\jpacs\Config\Cesar.xml">
	   <memoria>
		   <principal tamanho="1024" tempoacesso="100" />
		   <cache tamanho="3" tempoacesso="15" tamanhobloco="10">
                <fifo /> <paralelo /> <writethrought />
		    </cache>
    	 </memoria>
   </config>
</JPACS>