<?xml version="1.0" encoding="UTF-8"?>
<!DOCTYPE JPACS SYSTEM "JPACS.dtd">

<JPACS>
   <config nome="Config1.xml">
	   <memoria>
		   <principal tamanho="2048" tempoacesso="100" />
		   <cache tamanho="5" tempoacesso="15" tamanhobloco="10">
                <lru /> <sequencial /> <copyback />
		    </cache>
    	 </memoria>
   </config>
</JPACS>